{
  "$schema": "http://json-schema.org/draft-07/schema#",
  "title": "Generated schema for Root",
  "type": "array",
  "items": {
    "type": "object",
    "properties": {
      "index": {
        "type": "number"
      },
      "length": {
        "type": "number"
      },
      "number": {
        "type": "number"
      },
      "bands": {
        "type": "array",
        "items": {
          "type": "object",
          "properties": {
            "index": {
              "type": "number"
            },
            "start": {
              "type": "number"
            },
            "end": {
              "type": "number"
            },
            "color": {
              "type": "string"
            }
          }
        }
      }
    },
    "required": [
      "index",
      "length",
      "number",
      "bands"
    ]
  }
}